"","Type","Reference","Institution","Responsible","DOI"
"515","Literature","Occhipinti-Ambrogi Anna; Marchini Agnese; Cantone Grazia; Castelli Alberto; Chimenz Carla; Cormaci Mario; Froglia Carlo; Furnari Giovanni; Gambi Maria Cristina; Giaccone Giuseppe; Giangrande Adriana; Gravili Cinzia; Mastrototaro Francesco; Mazziotti Cristina; Orsi-Relini Lidia; Piraino Stefano (2010) Alien Species Along The Italian Coasts: An Overview. Biological Invasions, 13: 1, 215-237","","","10.1007/s10530-010-9803-y"
"516","Literature","Ogasawara Makoto; Matsui Toshiyuki; Agatsuma Yukio (2011) Growth And Rapid Gonad Recovery Of The Sea Urchinhemicentrotus Pulcherrimusafter Spawning In Anundaria Pinnatifidaandsaccharina Japonicakelp Bed. Journal of Shellfish Research, 30: 1, 159-166","","","10.2983/035.030.0123"
"517","Literature","Onitsuka Toshihiro; Unuma Tatsuya; Kawamura Tomohiko (2012) Effects Of Diet And Temperature On Post-settlement Growth And Survival Of The Short-spined Sea Urchinstrongylocentrotus Intermedius. Aquaculture Research, 45: 1, 1-15","","","10.1111/j.1365-2109.2012.03198.x"
"518","Literature","Park Kwang-Jae; Kim Bo-Yeon; Park Seo-Kyoung; Lee Jong-Hwa; Kim Young-Sik; Choi Han-Gil; Nam Ki-Wan (2012) Morphological And Biochemical Differences In Three Undaria Pinnatifida Populations In Korea. ALGAE, 27: 3, 189-196","","","10.4490/algae.2012.27.3.189"
"519","Literature","Peteiro César (2008) A New Record Of The Introduced Seaweed Undaria Pinnatifida (laminariales, Phaeophyceae) From The Cantabrian Sea (northern Spain) With Comments On Its Establishment. Aquatic Invasions, 3: 4, 413-415","","","10.3391/ai.2008.3.4.6"
"520","Literature","Peteiro César; Freire Óscar (2012) Outplanting Time And Methodologies Related To Mariculture Of The Edible Kelp Undaria Pinnatifida In The Atlantic Coast Of Spain. Journal of Applied Phycology, 24: 6, 1361-1372","","","10.1007/s10811-012-9788-2"
"521","Literature","Primo C.; Hewitt C. L.; Campbell M. L. (2010) Reproductive Phenology Of The Introduced Kelp Undaria Pinnatifida (phaeophyceae, Laminariales) In Port Phillip Bay (victoria, Australia). Biological Invasions, 12: 9, 3081-3092","","","10.1007/s10530-010-9700-4"
"522","Literature","Quero Grazia M.; Fasolato Luca; Vignaroli Carla; Luna Gian Marco (2015) Understanding The Association Of Escherichia Coli With Diverse Macroalgae In The Lagoon Of Venice. Scientific Reports, 5: 1, ","","","10.1038/srep10969"
"523","Literature","Raffo M. Paula; Eyras M. Cecilia; Iribarne Oscar O. (2009) The Invasion Of Undaria Pinnatifida To A Macrocystis Pyrifera Kelp In Patagonia (argentina, South-west Atlantic). Journal of the Marine Biological Association of the United Kingdom, 89: 08, 1571","","","10.1017/s002531540900071x"
"524","Literature","Rechimont M.E.; Galván D.E.; Sueiro M.C.; Casas G.; Piriz M.L.; Diez M.E.; Primost M.; Zabala M.S.; Márquez F.; Brogger M.; Alfaya J.E.F.; Bigatti G. (2013) Benthic Diversity And Assemblage Structure Of A North Patagonian Rocky Shore: A Monitoring Legacy Of The Nagisa Project. Journal of the Marine Biological Association of the United Kingdom, 93: 08, 2049-2058","","","10.1017/s0025315413001069"
"525","Literature","Richards DK; Hurd CL; Pritchard DW; Wing SR; Hepburn CD (2011) Photosynthetic Response Of Monospecific Macroalgal Stands To Density. Aquatic Biology, 13: 1, 41-49","","","10.3354/ab00349"
"526","Literature","Russell Lisa K.; Hepburn Christopher D.; Hurd Catriona L.; Stuart Michael D. (2007) The Expanding Range Of Undaria Pinnatifida In Southern New Zealand: Distribution, Dispersal Mechanisms And The Invasion Of Wave-exposed Environments. Biological Invasions, 10: 1, 103-115","","","10.1007/s10530-007-9113-1"
"527","Literature","Saitoh Kenji; Muraoka Daisuke (2006) Undaria Mitochondrial Large Subunit Ribosomal Dna (phaeophyceae, Alariaceae): Structural Properties And Use For Phylogenetic Analysis. Phycological Research, 54: 2, 149-153","","","10.1111/j.1440-1835.2006.00423.x"
"528","Literature","Sakamoto Nobuo; Kano Naoki; Imaizumi Hiroshi (2008) Biosorption Of Uranium And Rare Earth Elements Using Biomass Of Algae. Bioinorganic Chemistry and Applications, 2008: 1-8","","","10.1155/2008/706240"
"529","Literature","Schiel David R.; Thompson Glen A. (2012) Demography And Population Biology Of The Invasive Kelp Undaria Pinnatifida On Shallow Reefs In Southern New Zealand. Journal of Experimental Marine Biology and Ecology, 434-435: 25-33","","","10.1016/j.jembe.2012.07.023"
"530","Literature","Sfriso A.; Facca C. (2013) Annual Growth And Environmental Relationships Of The Invasive Species Sargassum Muticum And Undaria Pinnatifida In The Lagoon Of Venice. Estuarine, Coastal and Shelf Science, 129: 162-172","","","10.1016/j.ecss.2013.05.031"
"531","Literature","Shan Tifeng; Pang Shaojun; Liu Feng; Xu Na; Zhao Xiaobo; Gao Suqin (2012) High Genetic Diversity In Gametophyte Clones Of Undaria Pinnatifida From Vladivostok, Dalian And Qingdao Revealed Using Microsatellite Analysis. Chinese Journal of Oceanology and Limnology, 30: 2, 225-230","","","10.1007/s00343-012-1098-7"
"532","Literature","Shibneva S. Yu.; Skriptsova A. V. (2012) Morphological Variability Of Undaria Pinnatifida (harvey) Suringar, 1873 (phaeophyceae, Laminariales) In Peter The Great Bay, Sea Of Japan. Russian Journal of Marine Biology, 38: 5, 381-391","","","10.1134/s1063074012050070"
"533","Literature","Silva, P. C., Woodfield, R. A., Cohen, A. N., Harris, L. H., & Goddard, J. H. R. (2002). First Report Of The Asian Kelp Undaria Pinnatifida In The Northeastern Pacific Ocean. Biological Invasions, 4(3), 333–338.","","",""
"534","Literature","Sliwa Cathryn; Johnson Craig R.; Hewitt Chad L. (2006) Mesoscale Dispersal Of The Introduced Kelp Undaria Pinnatifida Attached To Unstable Substrata. Botanica Marina, 49: 5/6, ","","","10.1515/bot.2006.051"
"535","Literature","Stuart, M. D. (2003) Review Of Research On Undaria Pinnatifida In New Zealand And Its Potential Impacts On The Eastern Coast Of The South Island.  Doc Science Internal Series 166.","","",""
"536","Literature","TAKA TOSHIHIRO; YOSHIMITSU SATOSHI; IMAYOSHI YUJI; ISHIGA YOSHIE; TERADA RYUTA (2013) Distribution And Characteristics Of Seaweed/seagrass Community In Kagoshima Bay, Kagoshima Prefecture, Japan. NIPPON SUISAN GAKKAISHI, 79: 1, 20-30","","","10.2331/suisan.79.20"
"537","Literature","Teng Hongming; Yang Yazong; Wei Hengyun; Liu Zundong; Liu Zhichao; Ma Yanhong; Gao Zixiang; Hou Lin; Zou Xiangyang (2015) Fucoidan Suppresses Hypoxia-induced Lymphangiogenesis And Lymphatic Metastasis In Mouse Hepatocarcinoma. Marine Drugs, 13: 6, 3514-3530","","","10.3390/md13063514"
"538","Literature","Uwai Shinya; Arai Shogo; Morita Teruwo; Kawai Hiroshi (2007) Genetic Distinctness And Phylogenetic Relationships Among Undaria Species (laminariales, Phaeophyceae) Based On Mitochondrial Cox3 Gene Sequences. Phycological Research, 55: 4, 263-271","","","10.1111/j.1440-1835.2007.00469.x"
"539","Literature","Uwai Shinya; Nelson Wendy; Neill Kate; Wang Wei Ding; Aguilar-Rosas Luis E.; Boo Sung Min; Kitayama Taiju; Kawai Hiroshi (2007) Genetic Diversity In Undaria Pinnatifida (laminariales, Phaeophyceae) Deduced From Mitochondria Genes – Origins And Succession Of Introduced Populations. Phycologia, 45: 6, 687-695","","","10.2216/05-66.1"
"540","Literature","Uwai S.; Yotsukura N.; Serisawa Y.; Muraoka D.; Hiraoka M.; Kogame K. (2005) Intraspecific Genetic Diversity Of Undaria Pinnatifida In Japan, Based On The Mitochondrial Cox3 Gene And The Its1 Of Nrdna. Hydrobiologia, 553: 1, 345-356","","","10.1007/s10750-005-0883-0"
"541","Literature","Valentine Joseph P; Johnson Craig R (2003) Establishment Of The Introduced Kelp Undaria Pinnatifida In Tasmania Depends On Disturbance To Native Algal Assemblages. Journal of Experimental Marine Biology and Ecology, 295: 1, 63-90","","","10.1016/s0022-0981(03)00272-7"
"542","Literature","Veiga P.; Torres A.C.; Rubal M.; Troncoso J.; Sousa-Pinto I. (2014) The Invasive Kelp Undaria Pinnatifida (laminariales, Ochrophyta) Along The North Coast Of Portugal: Distribution Model Versus Field Observations. Marine Pollution Bulletin, 84: 1-2, 363-365","","","10.1016/j.marpolbul.2014.05.038"
"543","Literature","Venerus Leonardo A.; Irigoyen Alejo J.; Galvón David E.; Parma Ana M. (2013) Spatial Dynamics Of The Argentine Sandperch, Pseudopercis Semifasciata (pinguipedidae), In Temperate Rocky Reefs From Northern Patagonia, Argentina. Marine and Freshwater Research","","","10.1071/mf12163"
"544","Literature","Voisin M.; Engel C. R.; Viard F. (2005) Differential Shuffling Of Native Genetic Diversity Across Introduced Regions In A Brown Alga: Aquaculture Vs. Maritime Traffic Effects. Proceedings of the National Academy of Sciences, 102: 15, 5432-5437","","","10.1073/pnas.0501754102"
"545","Literature","Wallentinus, I., & International Council For The Exploration Of The Sea. (2007). Alien Species Alert: On Undaria Pinnatifida (wakame Or Japanese Kelp). Ices Wgitmo Report 2006 Working Group On Introductions And Transfers Of Marine Organisms ( Wgitmo )","","",""
"546","Literature","Wang Xiuliang; Wang Di; Li Dapeng; Duan Delin (2006) Genetic Analysis Of The Gametophytes Of Undaria Pinnatifida (phaeophyceae) With Issr Method. Aquaculture, 258: 1-4, 250-256","","","10.1016/j.aquaculture.2006.04.029"
"547","Literature","Watanabe Yuki; Nishihara Gregory N.; Tokunaga Shigemitsu; Terada Ryuta (2014) The Effect Of Irradiance And Temperature Responses And The Phenology Of A Native Alga, Undaria Pinnatifida (laminariales), At The Southern Limit Of Its Natural Distribution In Japan. Journal of Applied Phycology, 26: 6, 2405-2415","","","10.1007/s10811-014-0264-z"
"548","Literature","WON Nam-Il; KAWAMURA Tomohiko; ONITSUKA Toshihiro; HAYAKAWA Jun; WATABE Satoshi; HORII Toyomitsu; TAKAMI Hideki; WATABE Yoshiro (2007) Community And Trophic Structures Of Abalone Haliotis Diversicolor Habitat In Sagami Bay, Japan. Fisheries Science, 73: 5, 1123-1136","","","10.1111/j.1444-2906.2007.01444.x"
"549","Literature","Yamada Mika; Yamamoto Koshi; Ushihara Yasuhiro; Kawai Hiroshi (2007) Variation In Metal Concentrations In The Brown Alga Undaria Pinnatifida In Osaka Bay, Japan. Phycological Research, 55: 3, 222-230","","","10.1111/j.1440-1835.2007.00465.x"
"550","Literature","Yang M.; Her N.; Ryu J.; Yoon Y. (2013) Determination Of Perchlorate And Iodide Concentrations In Edible Seaweeds. International Journal of Environmental Science and Technology, 11: 3, 565-570","","","10.1007/s13762-013-0263-7"
"551","Literature","Yin Xu Wang; Min Wen Wu; Lin Hua Jian; Chen Wei (2012) Population Dynamics, Protein Content, And Lipid Composition Of Brachionus Plicatilis Fed Artificial Macroalgal Detritus And Nannochloropsis Sp. Diets. Aquaculture, 380-383: 62-69","","","10.1016/j.aquaculture.2012.11.018"
"552","Literature","Yoo, J.-t., Choi, Y.-m., Yang, M.-h., Im, Y.-j., Ko, J.-c., & Chang, D.-s. (2009). Biological Environmental Characteristics In Habitats Of An Abalone Haliotis Diversicolor In The Eastern Coast Of Jeju-do, Korea. The Korean Journal Of Malacology, 25, 231","","",""
"553","Literature","Zabin Chela; Ashton Gail; Brown Christopher; Ruiz Gregory (2009) Northern Range Expansion Of The Asian Kelp Undaria Pinnatifida (harvey) Suringar (laminariales, Phaeophyceae) In Western North America. Aquatic Invasions, 4: 3, 429-434","","","10.3391/ai.2009.4.3.1"
"554","Literature","Zhang S. Y.; Wang Lei; Wang W. D. (2008) Algal Communities At Gouqi Island In The Zhoushan Archipelago, China. Journal of Applied Phycology, 20: 5, 853-861","","","10.1007/s10811-008-9338-0"
"555","Literature","Zhou April Yongdong; Robertson John; Hamid Nazimah; Ma Qianli; Lu Jun (2014) Changes In Total Nitrogen And Amino Acid Composition Of New Zealand Undaria Pinnatifida With Growth, Location And Plant Parts. Food Chemistry, 186: 319-325","","","10.1016/j.foodchem.2014.06.016"
"556","Literature","Elso M. Zarranz; Manent P.; Luque A.; Ramdani M.; Robaina R.R. (2016) Genetic Description And Remote Sensing Techniques As Management Tools Forzostera Noltiiseagrass Populations Along The Atlantic Moroccan Coast. Journal of Coastal Research, 331: 78-87","","","10.2112/jcoastres-d-15-00111.1"
"557","Literature","Reusch T. B. H.; Stam W. T.; Olsen J. L. (2003) A Microsatellite-based Estimation Of Clonal Diversity And Population Subdivision In Zostera Marina, A Marine Flowering Plant. Molecular Ecology, 9: 2, 127-140","","","10.1046/j.1365-294x.2000.00839.x"
"558","Literature","Buonomo Roberto; Chefaoui Rosa M.; Lacida Ricardo Bermejo; Engelen Aschwin H.; Serrão Ester A.; Airoldi Laura (2018) Predicted Extinction Of Unique Genetic Diversity In Marine Forests Of  Cystoseira  Spp.. Marine Environmental Research, : ","","","10.1016/j.marenvres.2018.04.013"
"559","Literature","Riera Rodrigo; Sangil Carlos; Sansón Marta (2015) Long-term Herbarium Data Reveal The Decline Of A Temperate-water Algae At Its Southern Range. Estuarine, Coastal and Shelf Science, 165: 159-165","","","10.1016/j.ecss.2015.05.008"
"560","Literature","Coyer James A.; Hoarau Galice; Van Schaik Jaap; Luijckx Pepijn; Olsen Jeanine L. (2010) Trans-pacific And Trans-arctic Pathways Of The Intertidal Macroalga Fucus Distichus L. Reveal Multiple Glacial Refugia And Colonizations From The North Pacific To The North Atlantic. Journal of Biogeography, 38: 4, 756-771","","","10.1111/j.1365-2699.2010.02437.x"
"561","Literature","Jueterbock Alexander; Smolina Irina; Coyer James A.; Hoarau Galice (2016) The Fate Of The Arctic Seaweedfucus Distichusunder Climate Change: An Ecological Niche Modeling Approach. Ecology and Evolution, 6: 6, 1712-1724","","","10.1002/ece3.2001"
"562","Literature","Tsounis Georgios; Rossi Sergio; Gili Josep-Maria; Arntz Wolf (2006) Population Structure Of An Exploited Benthic Cnidarian: The Case Study Of Red Coral (corallium Rubrum L.). Marine Biology, 149: 5, 1059-1070","","","10.1007/s00227-006-0302-8"
"563","Literature","Rossi Sergio; Tsounis Georgios; Orejas Covadonga; Padrón Tirma; Gili Josep-Maria; Bramanti Lorenzo; Teixidó Núria; Gutt Julian (2008) Survey Of Deep-dwelling Red Coral (corallium Rubrum) Populations At Cap De Creus (nw Mediterranean). Marine Biology, 154: 3, 533-545","","","10.1007/s00227-008-0947-6"
"564","Literature","Costantini Federica; Taviani Marco; Remia Alessandro; Pintus Eleonora; Schembri Patrick J.; Abbiati Marco (2009) Deep-watercorallium Rubrum(l., 1758) From The Mediterranean Sea: Preliminary Genetic Characterisation. Marine Ecology, 31: 2, 261-269","","","10.1111/j.1439-0485.2009.00333.x"
"565","Literature","Tsounis Georgios; Rossi Sergio; Aranguren Maria; Gili Josep-Maria; Arntz Wolf (2005) Effects Of Spatial Variability And Colony Size On The Reproductive Output And Gonadal Development Cycle Of The Mediterranean Red Coral (corallium Rubrum L.). Marine Biology, 148: 3, 513-527","","","10.1007/s00227-005-0100-8"
"566","Literature","Cau Alessandro; Bramanti Lorenzo; Cannas Rita; Follesa Maria Cristina; Angiolillo Michela; Canese Simonepietro; Bo Marzia; Cuccu Danila; Guizien Katell (2016) Habitat Constraints And Self-thinning Shape Mediterranean Red Coral Deep Population Structure: Implications For Conservation Practice. Scientific Reports, 6: 1, ","","","10.1038/srep23322"
"567","Literature","Gallmetzer Ivo; Haselmair Alexandra; Velimirov Branko (2010) Slow Growth And Early Sexual Maturity: Bane And Boon For The Red Coral Corallium Rubrum. Estuarine, Coastal and Shelf Science, 90: 1, 1-10","","","10.1016/j.ecss.2010.04.018"
"568","Literature","Linares C; Bianchimani O; Torrents O; Marschal C; Drap P; Garrabou J (2009) Marine Protected Areas And The Conservation Of Long-lived Marine Invertebrates: The Mediterranean Red Coral. Marine Ecology Progress Series, 402: 69-79","","","10.3354/meps08436"
"569","Literature","Bramanti L.; Vielmini I.; Rossi S.; Tsounis G.; Iannelli M.; Cattaneo-Vietti R.; Priori C.; Santangelo G. (2014) Demographic Parameters Of Two Populations Of Red Coral (corallium Rubrum L. 1758) In The North Western Mediterranean. Marine Biology, 161: 5, 1015-1026","","","10.1007/s00227-013-2383-5"
"570","Literature","Priori Cristina; Mastascusa Vincenza; Erra Fabrizio; Angiolillo Michela; Canese Simonpietro; Santangelo Giovanni (2013) Demography Of Deep-dwelling Red Coral Populations: Age And Reproductive Structure Of A Highly Valued Marine Species. Estuarine, Coastal and Shelf Science, 118: 43-49","","","10.1016/j.ecss.2012.12.011"
"571","Literature","Angiolillo Michela; Gori Andrea; Canese Simonepietro; Bo Marzia; Priori Cristina; Bavestrello Giorgio; Salvati Eva; Erra Fabrizio; Greenacre Michael; Santangelo Giovanni (2015) Distribution And Population Structure Of Deep-dwelling Red Coral In The Northwest Mediterranean. Marine Ecology, 37: 2, 294-310","","","10.1111/maec.12274"
"572","Literature","Bavestrello G.; Bo M.; Canese S.; Sandulli R.; Cattaneo-Vietti R. (2014) The Red Coral Populations Of The Gulfs Of Naples And Salerno: Human Impact And Deep Mass Mortalities. Italian Journal of Zoology, 81: 4, 552-563","","","10.1080/11250003.2014.950349"
"573","Literature","COSTANTINI F.; FAUVELOT C.; ABBIATI M. (2007) Genetic Structuring Of The Temperate Gorgonian Coral (corallium Rubrum) Across The Western Mediterranean Sea Revealed By Microsatellites And Nuclear Sequences. Molecular Ecology, 16: 24, 5168-5182","","","10.1111/j.1365-294x.2007.03579.x"
"574","Literature","Aurelle D.; Ledoux J.-B.; Rocher C.; Borsa P.; Chenuil A.; Féral J.-P. (2011) Phylogeography Of The Red Coral (corallium Rubrum): Inferences On The Evolutionary History Of A Temperate Gorgonian. Genetica, 139: 7, 855-869","","","10.1007/s10709-011-9589-6"
"575","Literature","LEDOUX J.-B.; MOKHTAR-JAMAÏ K.; ROBY C.; FÉRAL J.-P.; GARRABOU J.; AURELLE D. (2010) Genetic Survey Of Shallow Populations Of The Mediterranean Red Coral [corallium Rubrum(linnaeus, 1758)]: New Insights Into Evolutionary Processes Shaping Nuclear Diversity And Implications For Conservation. Molecular Ecology, 19: 4, 675-690","","","10.1111/j.1365-294x.2009.04516.x"
"576","Literature","Petar Kružić, 2017. Can Red Coral (corallium Rubrum) Populations Benefit From Marine Protected. Areas In The Adriatic Sea. 52nd European Marine Biology Symposium-embs 52 , 155-155","","",""
"577","Literature","Costantini Federica; Carlesi Lorenzo; Abbiati Marco (2013) Quantifying Spatial Genetic Structuring In Mesophotic Populations Of The Precious Coral Corallium Rubrum. PLoS ONE, 8: 4, e61546","","","10.1371/journal.pone.0061546"
"578","Literature","Dounas C., Koutsoubas D., Salomidi M., Koulouri P., Gerovasileiou V. & Sini M. 2009. Distribution And Fisheries Of The Red Coral Corallium Rubrum (linnaeus, 1758) In The Greek Seas: An Overview. In: Proceedings Of The International Workshop On Red Coral Science, Management, And Trade: Lessons From The Mediterranean (e. Bussoletti, D. Cottingham, A. Bruckner, G. Roberts & R. Sandulli Eds), Pp. 104-114. Noaa Technical Memorandum Crcp-13: Silver Spring","","",""
"579","Literature","Salomidi, M., Smith, C., Katsanevakis, S., Panayotidis, P., Papathanassiou, V. 2009. Some Observations On The Structure And Distribution Of Gorgonian Assemblages In The Eastern Mediterranean Sea. Proceedings Of The 1st Symposium On The Coralligenous And Other Calcareous Bio- Concretions Of The Mediterranean Sea, Tabarka, 15-16 January 2009, 242-244.","","",""
"580","Literature","Çinar, M.e., Gönülal, O., & Öztürk, B. (2018) Wanted Dead Or Alive: Corallium Rubrum (cnidaria: Anthozoa) On The Coasts Of Turkey. Cahiers De Biologie Marine, 59, 175–179.","","",""
"581","Literature"," Institut National De Recherche Halieutique (2013)etat Des Stocks Et Des Pêcheries Au Maroc. Technical Report.","","",""
"582","Literature","Boavida Joana; Paulo Diogo; Aurelle Didier; Arnaud-Haond Sophie; Marschal Christian; Reed John; Gonçalves Jorge M. S.; Serrão Ester A. (2016) A Well-kept Treasure At Depth: Precious Red Coral Rediscovered In Atlantic Deep Coral Gardens (sw Portugal) After 300 Years. PLOS ONE, 11: 1, e0147228","","","10.1371/journal.pone.0147228"
"583","Literature","Abdelaziz Zoubi, 2009. ﻿an Overview Of The Main Marine Resources (commercial And Non- Commercial Groups) In The Moroccan Mediterranean. Noaa Technical Memorandum Nmfs-opr-43 And Crcp-8, Silver Spring, Md, 153","","",""
"584","Literature","Abdelmajid Dridi, 2009. ﻿mediterranean Red Coral Abdelmajid. Noaa Technical Memorandum Nmfs-opr-43 And Crcp-8, Silver Spring, Md, 109-115","","",""
"585","Literature","Weinbauer M. G.; Brandstätter F.; Velimirov B. (2002) On The Potential Use Of Magnesium And Strontium Concentrations As Ecological Indicators In The Calcite Skeleton Of The Red Coral ( Corallium Rubrum ). Marine Biology, 137: 5-6, 801-809","","","10.1007/s002270000432"
"586","Literature","Jaziri Sabri; Costantini Federica; Rugiu Luca; Abbiati Marco; Jarboui Othman (2016) Does Historical Harvesting Affect Colony Size Distribution And Genetic Diversity In Corallium Rubrum (linnaeus, 1758)? Evidences From The Southern Mediterranean Commercial Banks. Hydrobiologia, 784: 1, 211-224","","","10.1007/s10750-016-2875-7"
"587","Literature","Orfanidis S.; Papathanasiou V.; Gounaris S.; Theodosiou TH. (2009) Size Distribution Approaches For Monitoring And Conservation Of Coastalcymodoceahabitats. Aquatic Conservation: Marine and Freshwater Ecosystems, 20: 2, 177-188","","","10.1002/aqc.1069"
"588","Literature","Alberto Filipe; Massa Sónia; Manent Pablo; Diaz-Almela Elena; Arnaud-Haond Sophie; Duarte Carlos M.; Serrão Ester A. (2008) Genetic Differentiation And Secondary Contact Zone In The Seagrasscymodocea Nodosaacross The Mediterranean-atlantic Transition Region. Journal of Biogeography, 35: 7, 1279-1294","","","10.1111/j.1365-2699.2007.01876.x"
"589","Literature","Cunha Alexandra H.; Assis Jorge F.; Serrão Ester A. (2014) Reprint Of “seagrasses In Portugal: A Most Endangered Marine Habitat”. Aquatic Botany, 115: 3-13","","","10.1016/j.aquabot.2014.02.007"
"590","Literature","Kontiza Ioanna; Stavri Michael; Zloh Mire; Vagias Constantinos; Gibbons Simon; Roussis Vassilios (2008) New Metabolites With Antibacterial Activity From The Marine Angiosperm Cymodocea Nodosa. Tetrahedron, 64: 8, 1696-1702","","","10.1016/j.tet.2007.12.007"
"591","Literature","Kontiza Ioanna; Vagias Constantinos; Jakupovic Jasmin; Moreau Dimitri; Roussakis Christos; Roussis Vassilios (2005) Cymodienol And Cymodiene: New Cytotoxic Diarylheptanoids From The Sea Grass Cymodocea Nodosa. Tetrahedron Letters, 46: 16, 2845-2847","","","10.1016/j.tetlet.2005.02.123"
"592","Literature","Bonanno Giuseppe; Di Martino Vincenzo (2016) Seagrass  Cymodocea Nodosa  As A Trace Element Biomonitor: Bioaccumulation Patterns And Biomonitoring Uses. Journal of Geochemical Exploration, 169: 43-49","","","10.1016/j.gexplo.2016.07.010"
"593","Literature","Barsanti Mattia; Delbono Ivana; Ferretti Ornella; Peirano Andrea; Bianchi Carlo Nike; Morri Carla (2007) Measuring Change Of Mediterranean Coastal Biodiversity: Diachronic Mapping Of The Meadow Of The Seagrass Cymodocea Nodosa (ucria) Ascherson In The Gulf Of Tigullio (ligurian Sea, Nw Mediterranean). Hydrobiologia, 580: 1, 35-41","","","10.1007/s10750-006-0467-7"
"594","Literature","Souâd Turki, 2005. Distribution Of Toxic Dinoflagellates Along The Leaves Of Seagrass Posidonia Oceanica And Cymodocea Nodosa From The Gulf Of Tunis. Cahiers De Biologie Marine, 46, 29-34","","",""
"595","Literature","Garrido Marie; Lafabrie Céline; Torre Franck; Fernandez Catherine; Pasqualini Vanina (2013) Resilience And Stability Of Cymodocea Nodosa Seagrass Meadows Over The Last Four Decades In A Mediterranean Lagoon. Estuarine, Coastal and Shelf Science, 130: 89-98","","","10.1016/j.ecss.2013.05.035"
"596","Literature","Aligizaki Katerina; Nikolaidis Georgios (2006) The Presence Of The Potentially Toxic Genera Ostreopsis And Coolia (dinophyceae) In The North Aegean Sea, Greece. Harmful Algae, 5: 6, 717-730","","","10.1016/j.hal.2006.02.005"
"597","Literature","Tsirika Anastasia; Haritonidis Savvas (2005) A Survey Of The Benthic Flora In The National Marine Park Of Zakynthos (greece). Botanica Marina, 48: 1, ","","","10.1515/bot.2005.002"
"598","Literature","Sghaier Yassine Ramzi; Zakhama-Sraieb Rym; Charfi-Cheikhrouha Faouzia (2011) Primary Production And Biomass In A Cymodocea Nodosa Meadow In The Ghar El Melh Lagoon, Tunisia. Botanica Marina, 54: 4, ","","","10.1515/bot.2011.045"
"599","Literature","Mabrouk Lotfi; Ben Brahim Mounir; Hamza Asma; Mahfoudhi Mabrouka; Bradai Med Najmeddine (2014) A Comparison Of Abundance And Diversity Of Epiphytic Microalgal Assemblages On The Leaves Of The Seagrassesposidonia Oceanica(l.) Andcymodocea Nodosa(ucria) Asch In Eastern Tunisia. Journal of Marine Biology, 2014: 1-10","","","10.1155/2014/275305"
"600","Literature","﻿lotfi Rabaoui, Sabiha Tlig-zouari & Oum Kalthoum Ben Hassine, 2008. Distribution And Habitat Of The Fan Mussel Pinna Nobilis Linnaeus, 1758 (mollusca: Bivalvia) Along The Northern And Eastern Tunisian Coasts. Cahiers De Biologie Marine, 49, 67-78","","",""
"601","Literature","Marina Pablo; Urra Javier; Rueda José L.; Salas Carmen (2012) Composition And Structure Of The Molluscan Assemblage Associated With A Cymodocea Nodosa Bed In South-eastern Spain: Seasonal And Diel Variation. Helgoland Marine Research, 66: 4, 585-599","","","10.1007/s10152-012-0294-3"
"602","Literature","Mohamed Ramdani, , Fatima Sahnouni, Benyounes Haloui, Najat Elkhiati, Roger Flower, Abdelhakim Mesfioui,mohammed Ramdani, 2015. Macroepiphytes And Macroalgae ( Phaeophyceae , Rhodophyceae And Chlorophyceae ) In The Nador Lagoon ( Morocco ). Journal Of Biodiversity And Environmental Sciences, 7, 252-261","","",""
"603","Literature","﻿laila Natij, Karima Khalil, Mohammed Loudiki, And Khalid Elkalay, 2014. ﻿a First Attempt At Seagrass Repartitioning In The Moroccan Coasts. International Journal Of Innovation And Scientific Research Issn, 10, 401-408","","",""
